{
  "client_id": "gt-engineering",
  "client_name": "GT 엔지니어링",
  "industry": ["토목/건설", "시설안전관리", "종합건축", "해양 수리조선"],
  "decision_makers": ["대표 또는 회장"],
  "primary_contact": "미정",
  "known_assets": [
    "기존 PPT 콘텐츠",
    "기존 브로셔 인디자인/PDF/일러스트레이터 파일",
    "Framer 홈페이지 납품 링크",
    "로고/CI 프로토타입"
  ],
  "source_materials": [
    {
      "path": "project/gt-engineering/wecollavo-gt-engineering-estimate-draft.md",
      "purpose": "GT 전용 제안/견적 초안"
    },
    {
      "path": "project/gt-engineering/wecollavo-gt-engineering-homepage-handoff.md",
      "purpose": "홈페이지 마감 범위와 필요 자료"
    },
    {
      "path": "project/gt-engineering/wecollavo-gt-engineering-sales-script.md",
      "purpose": "고객 전달 문구와 미팅 클로징"
    }
  ],
  "constraints": [
    "자료가 정리되어 있지 않아 콘텐츠 정리 범위가 커질 수 있다.",
    "홈페이지는 https://gotogether.framer.website 기준으로 구조는 있으나 더미 데이터 교체가 필요하다.",
    "최종 가격과 납품 약속은 Human Linchpin Review 이후 확정한다.",
    "AI 백채널은 고객에게 직접 노출하지 않는다."
  ],
  "theme": {
    "brand_name": "GT 엔지니어링",
    "colors": {
      "background": "#ffffff",
      "text": "#171717",
      "accent": "#1f5eff",
      "muted": "#eef3ff"
    },
    "typography": {
      "font_family": "system-ui, -apple-system, BlinkMacSystemFont, Segoe UI, sans-serif"
    }
  }
}
